{
  "schema_version": 2,
  "artifact_kind": "signed-evidence",
  "envelope_id": "0123456789abcdef0123456789abcdef",
  "payload_kind": "records-hold-register",
  "issuer_id": "organization-01",
  "key_id": "records-key-01",
  "principal_id": "records-officer-01",
  "issued_at": "2026-08-22T11:59:00Z",
  "expires_at": "2026-08-22T13:00:00Z",
  "purpose": "records-disposition",
  "subject": "conservative-default",
  "nonce": "aaaaaaaaaaaaaaaaaaaaaaaaaaaaaaaaaaaaaaaaaaaaaaaaaaaaaaaaaaaaaaaa",
  "challenge_sha256": "bbbbbbbbbbbbbbbbbbbbbbbbbbbbbbbbbbbbbbbbbbbbbbbbbbbbbbbbbbbbbbbb",
  "binding_sha256": "cccccccccccccccccccccccccccccccccccccccccccccccccccccccccccccccc",
  "approval_ref": "records-approval-01",
  "payload_sha256": "dddddddddddddddddddddddddddddddddddddddddddddddddddddddddddddddd",
  "signature_algorithm": "RS256",
  "payload": {
    "schema_version": 1,
    "artifact_kind": "records-hold-register",
    "policy_id": "conservative-default",
    "policy_sha256": "eeeeeeeeeeeeeeeeeeeeeeeeeeeeeeeeeeeeeeeeeeeeeeeeeeeeeeeeeeeeeeee",
    "target_root_hash": "ffffffffffffffffffffffffffffffffffffffffffffffffffffffffffffffff",
    "effective_at": "2026-08-22T11:00:00Z",
    "expires_at": "2026-08-22T13:00:00Z",
    "holds": [
      {
        "hold_id": "matter-01",
        "scope": "classes",
        "artifact_classes": ["memory"],
        "record_ids": [],
        "owner_id": "legal-team",
        "reason_code": "ACTIVE_MATTER",
        "active_from": "2026-08-01T00:00:00Z",
        "expires_at": null
      }
    ]
  },
  "signature": "AQAB"
}
